<?xml version="1.0" encoding="UTF-8"?>
<rrd-graph xmlns:xsi="http://www.w3.org/2001/XMLSchema-instance"
   xsi:noNamespaceSchemaLocation="../../../../../../../_TOOLS/xml/rrd-graph.xsd">
   <header name="pcengines_alix" title="PC Engines ALIX"/>
   <rrd db="sensors-lm86-i2c-0-4c"/>
   <hwmon chip="lm86-i2c-0-4c"/>
   <graph name="temp" tab="${_HWSUPP_TEMP}" title="${_HWSUPP_RT_TEMP}" label="${_HWSUPP_RL_TEMP}">
      <group>
         <var label="${_HWSUPP_RC_CPU}" rrd="temperature-temp2" sensor="temp2" color="#FF0000" format="%.1lf"/>
         <var label="${_HWSUPP_RC_MB}" rrd="temperature-temp1" sensor="temp1" color="#0000FF" format="%.1lf"/>
      </group>
   </graph>
   <include name="hwmon" tab="${_HWSUPP_HWMON}" include="hwmon-pcengines-alix.inc" func="hwmon_pcengines_alix"/>
   <include name="bios" tab="${_HWSUPP_DMI}" include="extra-dmidecode.inc" func="extra_dmidecode"/>
   <include name="alix" tab="alix" include="extra-pcengines-alix.inc" func="extra_pcengines_alix"/>
</rrd-graph>
