<?xml version="1.0" encoding="UTF-8"?>
<rrd-graph xmlns:xsi="http://www.w3.org/2001/XMLSchema-instance"
   xsi:noNamespaceSchemaLocation="../../../../../../../_TOOLS/xml/rrd-graph.xsd">
   <header name="aewin_scb6971" title="AEWIN SCB6971"/>
   <rrd db="sensors-w83627hf-isa-0290"/>
   <hwmon chip="w83627hf-isa-0290"/>
   <graph name="temp" tab="${_HWSUPP_TEMP}" title="${_HWSUPP_RT_TEMP}" label="${_HWSUPP_RL_TEMP}">
      <group>
         <var label="${_HWSUPP_RC_CPU}" rrd="temperature-temp2" sensor="temp2" color="#FF0000" format="%.1lf"/>
         <var label="${_HWSUPP_RC_MB}" rrd="temperature-temp1" sensor="temp1" color="#0000FF" format="%.1lf"/>
      </group>
   </graph>
   <graph name="voltage" tab="${_HWSUPP_VOLTAGE}" title="${_HWSUPP_RT_VOLTAGE}" label="${_HWSUPP_RL_VOLTAGE}">
      <group>
         <var label="${_HWSUPP_RC_VCORE}1" rrd="voltage-in0" sensor="in0" color="#FF0000" format="%.2lf"/>
         <var label="${_HWSUPP_RC_VCORE}2" rrd="voltage-in1" sensor="in1" color="#FFFF00" format="%.2lf"/>
         <var label="${_HWSUPP_RC_V3_3}" rrd="voltage-in2" sensor="in2" color="#00FF00" format="%.2lf"/>
         <var label="${_HWSUPP_RC_V5}" rrd="voltage-in3" sensor="in3" color="#0000FF" format="%.2lf"/>
         <var label="${_HWSUPP_RC_VCC}" rrd="voltage-in7" sensor="in7" color="#FF00FF" format="%.2lf"/>
         <var label="${_HWSUPP_RC_VBAT}" rrd="voltage-in8" sensor="in8" color="#00FFFF" format="%.2lf"/>
      </group>
   </graph>
   <include name="hwmon" tab="${_HWSUPP_HWMON}" include="hwmon-aewin-scb6971.inc" func="hwmon_aewin_scb6971"/>
   <include name="bios" tab="${_HWSUPP_DMI}" include="extra-dmidecode.inc" func="extra_dmidecode"/>
</rrd-graph>
