<?xml version="1.0" encoding="UTF-8"?>
<rrd-graph xmlns:xsi="http://www.w3.org/2001/XMLSchema-instance"
   xsi:noNamespaceSchemaLocation="../../../../../../../_TOOLS/xml/rrd-graph.xsd">
   <header name="raspberry_pi" title="Raspberry Pi"/>
   <rrd db="sensors-bcm2835_thermal-virtual-0"/>
   <hwmon chip="bcm2835_thermal-virtual-0"/>
   <graph name="temp" tab="${_HWSUPP_TEMP}" title="${_HWSUPP_RT_TEMP}" label="${_HWSUPP_RL_TEMP}">
      <group>
         <var label="${_HWSUPP_RC_SOC}" rrd="temperature-temp1" sensor="temp1" color="#FF0000" format="%.1lf"/>
      </group>
   </graph>
   <include name="hwmon" tab="${_HWSUPP_HWMON}" include="hwmon-raspberry-pi.inc" func="hwmon_raspberry_pi"/>
</rrd-graph>
