<?xml version="1.0" encoding="UTF-8"?>
<rrd-graph xmlns:xsi="http://www.w3.org/2001/XMLSchema-instance"
   xsi:noNamespaceSchemaLocation="../../../../../../../_TOOLS/xml/rrd-graph.xsd">
   <header name="bananapi_r1" title="Banana Pi R1"/>
   <rrd db="sensors-axp209-isa-0000"/>
   <hwmon chip="axp209-isa-0000"/>
   <graph name="temp" tab="${_HWSUPP_TEMP}" title="${_HWSUPP_RT_TEMP}" label="${_HWSUPP_RL_TEMP}">
      <group>
         <var label="${_HWSUPP_RC_SOC}" rrd="temperature-temp1" sensor="temp1" color="#FF0000" format="%.1lf">
            <rrd db="sensors-sun4i_ts-isa-0000"/>
            <hwmon chip="sun4i_ts-isa-0000"/>
         </var>
         <var label="${_HWSUPP_RC_CHIP}" rrd="temperature-temp1" sensor="temp1" color="#0000FF" format="%.1lf">
         </var>
      </group>
   </graph>
   <graph name="voltage" tab="${_HWSUPP_VOLTAGE}" title="${_HWSUPP_RT_VOLTAGE}" label="${_HWSUPP_RL_VOLTAGE}">
      <group>
         <var label="${_HWSUPP_RC_ACIN}" rrd="voltage-in0" sensor="in0" color="#FF0000" format="%.2lf"/>
         <var label="${_HWSUPP_RC_VBUS}" rrd="voltage-in1" sensor="in1" color="#FFFF00" format="%.2lf"/>
         <var label="${_HWSUPP_RC_VBAT}" rrd="voltage-in2" sensor="in2" color="#00FF00" format="%.2lf"/>
         <var label="${_HWSUPP_RC_APS}" rrd="voltage-in3" sensor="in3" color="#0000FF" format="%.2lf"/>
      </group>
   </graph>
   <include name="hwmon" tab="${_HWSUPP_HWMON}" include="hwmon-bananapi-r1.inc" func="hwmon_bananapi_r1"/>
</rrd-graph>
