<?xml version="1.0" encoding="UTF-8"?>
<rrd-graph xmlns:xsi="http://www.w3.org/2001/XMLSchema-instance"
   xsi:noNamespaceSchemaLocation="../../../../../../../_TOOLS/xml/rrd-graph.xsd">
   <header name="soekris_net4801" title="Soekris"/>
   <rrd db="sensors-pc87366-isa-6620"/>
   <hwmon chip="pc87366-isa-6620"/>
   <graph name="temp" tab="${_HWSUPP_TEMP}" title="${_HWSUPP_RT_TEMP}" label="${_HWSUPP_RL_TEMP}">
      <group>
         <var label="${_HWSUPP_RC_CPU}" rrd="temperature-temp3" sensor="temp3" color="#FF0000" format="%.1lf"/>
      </group>
   </graph>
   <graph name="voltage" tab="${_HWSUPP_VOLTAGE}" title="${_HWSUPP_RT_VOLTAGE}" label="${_HWSUPP_RL_VOLTAGE}">
      <group>
         <var label="${_HWSUPP_RC_VCORE}" rrd="voltage-in1" sensor="in1" color="#FF0000" format="%.2lf"/>
         <var label="${_HWSUPP_RC_VCC}" rrd="voltage-in2" sensor="in2" color="#FFFF00" format="%.2lf"/>
         <var label="${_HWSUPP_RC_VPWR}" rrd="voltage-in3" sensor="in3" color="#00FF00" format="%.2lf"/>
         <var label="${_HWSUPP_RC_V12}" rrd="voltage-in4" sensor="in4" color="#0000FF" format="%.2lf"/>
         <var label="${_HWSUPP_RC_V12M}" rrd="voltage-in5" sensor="in5" color="#FF00FF" format="%.2lf"/>
         <var label="Vsb" rrd="voltage-in7" sensor="in7" color="#00FFFF" format="%.2lf"/>
         <var label="Vdd" rrd="voltage-in8" sensor="in8" color="#990000" format="%.2lf"/>
         <var label="${_HWSUPP_RC_VBAT}" rrd="voltage-in9" sensor="in9" color="#999900" format="%.2lf"/>
         <var label="AVdd" rrd="voltage-in10" sensor="in10" color="#009900" format="%.2lf"/>
      </group>
   </graph>
   <include name="hwmon" tab="${_HWSUPP_HWMON}" include="hwmon-soekris-net4801.inc" func="hwmon_soekris_net4801"/>
   <include name="bios" tab="${_HWSUPP_DMI}" include="extra-dmidecode.inc" func="extra_dmidecode"/>
</rrd-graph>
