<?xml version="1.0" encoding="UTF-8"?>
<rrd-graph xmlns:xsi="http://www.w3.org/2001/XMLSchema-instance"
   xsi:noNamespaceSchemaLocation="../../../../../../../_TOOLS/xml/rrd-graph.xsd">
   <header name="pcengines_wrap" title="PC Engines WRAP"/>
   <rrd db="sensors-lm77-i2c-0-48"/>
   <hwmon chip="lm77-i2c-0-48"/>
   <graph name="temp" tab="${_HWSUPP_TEMP}" title="${_HWSUPP_RT_TEMP}" label="${_HWSUPP_RT_TEMP}">
      <group>
         <var label="${_HWSUPP_RC_CPU}" rrd="temperature-temp1" sensor="temp1" color="#FF0000" format="%.1lf"/>
      </group>
   </graph>
   <include name="hwmon" tab="${_HWSUPP_HWMON}" include="hwmon-pcengines-wrap.inc" func="hwmon_pcengines_wrap"/>
   <include name="bios" tab="${_HWSUPP_DMI}" include="extra-dmidecode.inc" func="extra_dmidecode"/>
   <include name="wrap" tab="wrap" include="extra-pcengines-wrap.inc" func="extra_pcengines_wrap"/>
</rrd-graph>
