<?xml version="1.0" encoding="UTF-8"?>
<rrd-graph xmlns:xsi="http://www.w3.org/2001/XMLSchema-instance"
   xsi:noNamespaceSchemaLocation="../../../../../../../_TOOLS/xml/rrd-graph.xsd">
   <rrd name="apcups" db="apcups" title="APC-UPS"/>
   <graph name="charge" title="${_RRD3_RT_CHARGE}" label="${_RRD3_RL_CHARGE}">
      <group>
         <var label="${_RRD3_RC_BATTERY}" rrd="charge" color="#009900" format="%.1lf"/>
      </group>
   </graph>
   <graph name="frequency" title="${_RRD3_RT_FREQUENCY}" label="${_RRD3_RL_FREQUENCY}">
      <group>
         <var label="${_RRD3_RC_INPUT}" rrd="frequency-input" val="frequency" color="#009900" format="%.2lf"/>
      </group>
   </graph>
   <graph name="load" title="${_RRD3_RT_LOAD}" label="${_RRD3_RL_LOAD}">
      <group>
         <var label="${_RRD3_RC_OUTPUT}" rrd="percent-load" val="percent" color="#FF0000" format="%.1lf"/>
      </group>
   </graph>
   <graph name="temperature" title="${_RRD3_RT_TEMPERATUE}" label="${_RRD3_RL_TEMPERATUE}">
      <group>
         <var label="${_RRD3_RC_INTERNAL}" rrd="temperature" color="#009900" format="%.1lf"/>
      </group>
   </graph>
   <graph name="timeleft" title="${_RRD3_RT_TIMELEFT}" label="${_RRD3_RL_TIMELEFT}">
      <group>
         <var label="${_RRD3_RC_BATTERY}" rrd="timeleft" val="timeleft" color="#009900" format="%.1lf"/>
      </group>
   </graph>
   <graph name="batvolt" title="${_RRD3_RT_BATVOLT}" label="${_RRD3_RL_VOLT}">
      <group>
         <var label="${_RRD3_RC_BATTERY}" rrd="voltage-battery" color="#009900" format="%.2lf"/>
      </group>
   </graph>
   <graph name="pwrvolt" title="${_RRD3_RT_PWRVOLT}" label="${_RRD3_RL_VOLT}">
      <group>
         <var label="${_RRD3_RC_INPUT}" rrd="voltage-input" color="#009900" format="%.1lf"/>
         <var label="${_RRD3_RC_OUTPUT}" rrd="voltage-output" color="#FF0000" format="%.1lf">
            <disp-scale val="0.2" op="+"/>
         </var>
      </group>
   </graph>
</rrd-graph>
