<?xml version="1.0" encoding="UTF-8"?>
<rrd-graph xmlns:xsi="http://www.w3.org/2001/XMLSchema-instance"
   xsi:noNamespaceSchemaLocation="../../../../../../../_TOOLS/xml/rrd-graph.xsd">
   <header name="pcengines_apu" title="PC Engines APU"/>
   <rrd db="sensors-k10temp-pci-00c3"/>
   <hwmon chip="k10temp-pci-00c3"/>
   <graph name="temp" tab="${_HWSUPP_TEMP}" title="${_HWSUPP_RT_TEMP}" label="${_HWSUPP_RL_TEMP}">
      <group>
         <var label="${_HWSUPP_RC_CPU}" rrd="temperature-temp1" sensor="temp1" color="#FF0000" format="%.1lf"/>
      </group>
   </graph>
   <graph name="frequency" tab="${_HWSUPP_FREQUENCY}" title="${_HWSUPP_RT_FREQUENCY}" label="${_HWSUPP_RL_FREQUENCY}">
      <rrd db="cpufreq" exponent="0"/>
      <cat path="/sys/devices/system/cpu"/>
      <group>
         <var label="${_HWSUPP_RC_CPU} 0" rrd="cpufreq-0" cat="cpu0/cpufreq/cpuinfo_cur_freq" color="#FF0000" format="%.1lf">
            <cat-scale val="1000" op="/"/>
            <scale val="1000000" op="/"/>
         </var>
         <var label="${_HWSUPP_RC_CPU} 1" rrd="cpufreq-1" cat="cpu1/cpufreq/cpuinfo_cur_freq" color="#00FF00" format="%.1lf">
            <cat-scale val="1000" op="/"/>
            <scale val="1000000" op="/"/>
         </var>
      </group>
   </graph>
   <include name="hwmon" tab="${_HWSUPP_HWMON}" include="hwmon-pcengines-apu.inc" func="hwmon_pcengines_apu"/>
   <include name="cpufreq" tab="${_HWSUPP_CPUFREQ}" include="extra-cpufreq.inc" func="extra_cpufreq" condition="$hwsupp_cpufreq"/>
   <include name="bios" tab="${_HWSUPP_DMI}" include="extra-dmidecode.inc" func="extra_dmidecode"/>
</rrd-graph>
