<?xml version="1.0" encoding="UTF-8"?>
<rrd-graph xmlns:xsi="http://www.w3.org/2001/XMLSchema-instance"
   xsi:noNamespaceSchemaLocation="../../../../../../../_TOOLS/xml/rrd-graph.xsd">
   <header name="msi_ms_9803" title="MSI MS-9803"/>
   <rrd db="none"/>
   <hwmon chip="none"/>
   <graph name="frequency" tab="${_HWSUPP_FREQUENCY}" title="${_HWSUPP_RT_FREQUENCY}" label="${_HWSUPP_RL_FREQUENCY}">
      <rrd db="cpufreq" exponent="0"/>
      <cat path="/sys/devices/system/cpu"/>
      <group>
         <var label="${_HWSUPP_RC_CPU} 0" rrd="cpufreq-0" cat="cpu0/cpufreq/cpuinfo_cur_freq" color="#FF0000" format="%.1lf">
            <cat-scale val="1000" op="/"/>
            <scale val="1000000" op="/"/>
         </var>
         <var label="${_HWSUPP_RC_CPU} 1" rrd="cpufreq-1" cat="cpu1/cpufreq/cpuinfo_cur_freq" color="#00FF00" format="%.1lf">
            <cat-scale val="1000" op="/"/>
            <scale val="1000000" op="/"/>
         </var>
         <var label="${_HWSUPP_RC_CPU} 2" rrd="cpufreq-2" cat="cpu2/cpufreq/cpuinfo_cur_freq" color="#0000FF" format="%.1lf">
            <cat-scale val="1000" op="/"/>
            <scale val="1000000" op="/"/>
         </var>
         <var label="${_HWSUPP_RC_CPU} 3" rrd="cpufreq-3" cat="cpu3/cpufreq/cpuinfo_cur_freq" color="#FFFF00" format="%.1lf">
            <cat-scale val="1000" op="/"/>
            <scale val="1000000" op="/"/>
         </var>
      </group>
      <group>
         <var label="${_HWSUPP_RC_CPU} 0" rrd="cpufreq-0" cat="cpu0/cpufreq/cpuinfo_cur_freq" color="#FF0000" format="%.1lf">
            <cat-scale val="1000" op="/"/>
            <scale val="1000000" op="/"/>
         </var>
         <var label="${_HWSUPP_RC_CPU} 1" rrd="cpufreq-1" cat="cpu1/cpufreq/cpuinfo_cur_freq" color="#00FF00" format="%.1lf">
            <cat-scale val="1000" op="/"/>
            <scale val="1000000" op="/"/>
         </var>
      </group>
      <group>
         <var label="${_HWSUPP_RC_CPU} 0" rrd="cpufreq-0" cat="cpu0/cpufreq/cpuinfo_cur_freq" color="#FF0000" format="%.1lf">
            <cat-scale val="1000" op="/"/>
            <scale val="1000000" op="/"/>
         </var>
      </group>
   </graph>
   <include name="hwmon" tab="${_HWSUPP_HWMON}" include="hwmon-msi-ms-9803.inc" func="hwmon_msi_ms_9803"/>
   <include name="cpufreq" tab="${_HWSUPP_CPUFREQ}" include="extra-cpufreq.inc" func="extra_cpufreq" condition="$hwsupp_cpufreq"/>
   <include name="bios" tab="${_HWSUPP_DMI}" include="extra-dmidecode.inc" func="extra_dmidecode"/>
</rrd-graph>
