<?xml version="1.0" encoding="UTF-8"?>
<rrd-graph xmlns:xsi="http://www.w3.org/2001/XMLSchema-instance"
   xsi:noNamespaceSchemaLocation="../../../../../../../_TOOLS/xml/rrd-graph.xsd">
   <header name="tyan_s5112" title="Tyan S5112"/>
   <rrd db="sensors-adm1027-isa-0000"/>
   <hwmon chip="adm1027-isa-0000"/>
   <graph name="temp" tab="${_HWSUPP_TEMP}" title="${_HWSUPP_RT_TEMP}" label="${_HWSUPP_RL_TEMP}">
      <group>
         <var label="${_HWSUPP_RC_CPU}" rrd="temperature-temp1" sensor="temp1" color="#FF0000" format="%.1lf"/>
         <var label="${_HWSUPP_RC_SYS}" rrd="temperature-temp2" sensor="temp2" color="#0000FF" format="%.1lf"/>
         <var label="VRM" rrd="temperature-temp3" sensor="temp3" color="#00FF00" format="%.1lf"/>
      </group>
   </graph>
   <graph name="voltage" tab="${_HWSUPP_VOLTAGE}" title="${_HWSUPP_RT_VOLTAGE}" label="${_HWSUPP_RL_VOLTAGE}">
      <group>
         <var label="DDR ${_HWSUPP_RC_VCC}" rrd="voltage-in0" sensor="in0" color="#FF0000" format="%.2lf"/>
         <var label="${_HWSUPP_RC_V3SB}" rrd="voltage-in2" sensor="in2" color="#FFFF00" format="%.2lf"/>
         <var label="${_HWSUPP_RC_V5}" rrd="voltage-in3" sensor="in3" color="#00FF00" format="%.2lf"/>
         <var label="DDR Vtt" rrd="voltage-in4" sensor="in4" color="#0000FF" format="%.2lf"/>
      </group>
   </graph>
   <graph name="fanspeed" tab="${_HWSUPP_FANSPEED}" title="${_HWSUPP_RT_FANSPEED}" label="${_HWSUPP_RL_FANSPEED}">
      <group>
         <var label="${_HWSUPP_RC_CPU}" rrd="fanspeed-fan1" sensor="fan1" color="#FF0000" format="%.1lf"/>
         <var label="${_HWSUPP_RC_CHASSIS} 2" rrd="fanspeed-fan2" sensor="fan2" color="#FFFF00" format="%.1lf"/>
         <var label="${_HWSUPP_RC_CHASSIS} 3" rrd="fanspeed-fan3" sensor="fan3" color="#00FF00" format="%.1lf"/>
         <var label="${_HWSUPP_RC_CHASSIS} 4" rrd="fanspeed-fan1" sensor="fan1" color="#0000FF" format="%.1lf">
            <rrd db="sensors-w83627hf-isa-0290"/>
            <hwmon chip="w83627hf-isa-0290"/>
         </var>
         <var label="${_HWSUPP_RC_CHASSIS} 5" rrd="fanspeed-fan2" sensor="fan2" color="#FFFF00" format="%.1lf">
            <rrd db="sensors-w83627hf-isa-0290"/>
            <hwmon chip="w83627hf-isa-0290"/>
         </var>
         <var label="${_HWSUPP_RC_CHASSIS} 6" rrd="fanspeed-fan4" sensor="fan4" color="#00FFFF" format="%.1lf"/>
         <var label="${_HWSUPP_RC_CHASSIS} 7" rrd="fanspeed-fan3" sensor="fan3" color="#990000" format="%.1lf">
            <rrd db="sensors-w83627hf-isa-0290"/>
            <hwmon chip="w83627hf-isa-0290"/>
         </var>
      </group>
   </graph>
   <include name="hwmon" tab="${_HWSUPP_HWMON}" include="hwmon-tyan-s5112.inc" func="hwmon_tyan_s5112"/>
   <include name="bios" tab="${_HWSUPP_DMI}" include="extra-dmidecode.inc" func="extra_dmidecode"/>
</rrd-graph>
