<?xml version="1.0" encoding="UTF-8"?>
<rrd-graph xmlns:xsi="http://www.w3.org/2001/XMLSchema-instance"
   xsi:noNamespaceSchemaLocation="../../../../../../../_TOOLS/xml/rrd-graph.xsd">
   <header name="commell_le575" title="Commell LE-575"/>
   <rrd db="sensors-w83627thf-isa-0290"/>
   <hwmon chip="w83627thf-isa-0290"/>
   <graph name="temp" tab="${_HWSUPP_TEMP}" title="${_HWSUPP_RT_TEMP}" label="${_HWSUPP_RL_TEMP}">
      <group>
         <var label="${_HWSUPP_RC_CPU}" rrd="temperature-temp1" sensor="temp1" color="#FF0000" format="%.1lf"/>
         <var label="${_HWSUPP_RC_MB}" rrd="temperature-temp2" sensor="temp2" color="#0000FF" format="%.1lf"/>
         <var label="${_HWSUPP_RC_CORE} 0" rrd="temperature-temp2" sensor="temp2" color="#00FF00" format="%.1lf">
            <rrd db="sensors-coretemp-isa-0000"/>
            <hwmon chip="coretemp-isa-0000"/>
         </var>
      </group>
   </graph>
   <graph name="voltage" tab="${_HWSUPP_VOLTAGE}" title="${_HWSUPP_RT_VOLTAGE}" label="${_HWSUPP_RL_VOLTAGE}">
      <group>
         <var label="${_HWSUPP_RC_VCORE}" rrd="voltage-in0" sensor="in0" color="#FF0000" format="%.2lf"/>
         <var label="${_HWSUPP_RC_V12}" rrd="voltage-in1" sensor="in1" color="#FFFF00" format="%.2lf"/>
         <var label="${_HWSUPP_RC_VCC}" rrd="voltage-in3" sensor="in3" color="#00FF00" format="%.2lf"/>
         <var label="${_HWSUPP_RC_V3_3}" rrd="voltage-in4" sensor="in4" color="#0000FF" format="%.2lf"/>
         <var label="${_HWSUPP_RC_V5SB}" rrd="voltage-in7" sensor="in7" color="#FF00FF" format="%.2lf"/>
         <var label="${_HWSUPP_RC_VBAT}" rrd="voltage-in8" sensor="in8" color="#00FFFF" format="%.2lf"/>
      </group>
   </graph>
   <graph name="fanspeed" tab="${_HWSUPP_FANSPEED}" title="${_HWSUPP_RT_FANSPEED}" label="${_HWSUPP_RL_FANSPEED}">
      <group>
         <var label="${_HWSUPP_RC_CPU}" rrd="fanspeed-fan1" sensor="fan1" color="#FF0000" format="%.1lf"/>
         <var label="${_HWSUPP_RC_MB}" rrd="fanspeed-fan2" sensor="fan2" color="#0000FF" format="%.1lf"/>
      </group>
   </graph>
   <graph name="frequency" tab="${_HWSUPP_FREQUENCY}" title="${_HWSUPP_RT_FREQUENCY}" label="${_HWSUPP_RL_FREQUENCY}">
      <rrd db="cpufreq" exponent="0"/>
      <cat path="/sys/devices/system/cpu"/>
      <group>
         <var label="${_HWSUPP_RC_CPU} 0" rrd="cpufreq-0" cat="cpu0/cpufreq/cpuinfo_cur_freq" color="#FF0000" format="%.1lf">
            <cat-scale val="1000" op="/"/>
            <scale val="1000000" op="/"/>
         </var>
         <var label="${_HWSUPP_RC_CPU} 1" rrd="cpufreq-1" cat="cpu1/cpufreq/cpuinfo_cur_freq" color="#00FF00" format="%.1lf">
            <cat-scale val="1000" op="/"/>
            <scale val="1000000" op="/"/>
         </var>
      </group>
   </graph>
   <include name="hwmon" tab="${_HWSUPP_HWMON}" include="hwmon-commell-le575.inc" func="hwmon_commell_le575"/>
   <include name="cpufreq" tab="${_HWSUPP_CPUFREQ}" include="extra-cpufreq.inc" func="extra_cpufreq" condition="$hwsupp_cpufreq"/>
   <include name="bios" tab="${_HWSUPP_DMI}" include="extra-dmidecode.inc" func="extra_dmidecode"/>
</rrd-graph>
